"Mode Cardinal Weak","You prefer to follow in other people's footsteps rather than initiate actions. You can be relied on to come up with the goods as long as someone else has the initial ideas. Your survival mechanisms are weak."
"Mode Cardinal Strong","You enjoy challenge and action, and become frustrated when you have no recourse for change. You expect others to also rise to a challenge."
"Mode Fixed Weak","You like to flit from one thing to another, finding difficult to settle down. You enjoy change, although you lack the stability needed to see things through."
"Mode Fixed Strong","You do not enjoy change. You expect others to be reliable, like yourself."
"Mode Mutable Weak","You find it difficult to adapt to new situations. You tend to be inflexible when faced with the demands of change and other people."
"Mode Mutable Strong","You may procrastinate. You expect others to be flexible, like yourself."
